{
  "schemaVersion": "1.0",
  "documentType": "screen",
  "id": "customer_service_catalog_paged",
  "product": "customer_app",
  "themeId": "customer-default",
  "themeMode": "light",
  "root": {
    "type": "ScreenTemplate",
    "props": {
      "headerGap": 8,
      "bodyPadding": { "all": 16 },
      "primaryScrollPadding": { "horizontal": 16 },
      "footerPadding": { "left": 16, "top": 0, "right": 16, "bottom": 16 }
    },
    "slots": {
      "body": [
        {
          "type": "RemotePagedList",
          "props": {
            "key": "service_definitions_paged",
            "path": "/v1/service-definitions/paged",
            "itemsPath": "items",
            "nextCursorPath": "next.cursor",
            "cursorParam": "cursor",
            "params": {
              "limit": "10"
            }
          },
          "slots": {
            "loading": [
              {
                "type": "InfoCard",
                "props": {
                  "title": "Loading…",
                  "subtitle": "Fetching services"
                }
              }
            ],
            "error": [
              {
                "type": "InfoCard",
                "props": {
                  "title": "Unable to load",
                  "subtitle": "Please try again"
                }
              }
            ],
            "empty": [
              {
                "type": "InfoCard",
                "props": {
                  "title": "No services",
                  "subtitle": "Nothing available right now"
                }
              }
            ],
            "item": [
              {
                "type": "BoundActionCard",
                "props": {
                  "titlePath": "title",
                  "subtitlePath": "subtitle",
                  "iconPath": "icon",
                  "routePath": "detailRoute",
                  "surface": "raised"
                }
              },
              {
                "type": "Gap",
                "props": {
                  "height": 12
                }
              }
            ],
            "loadingMore": [
              {
                "type": "InfoCard",
                "props": {
                  "title": "Loading more…"
                }
              }
            ],
            "errorMore": [
              {
                "type": "InfoCard",
                "props": {
                  "title": "Could not load more",
                  "subtitle": "Scroll up and try again"
                }
              }
            ]
          }
        }
      ]
    },
    "actions": {}
  },
  "actions": {}
}
